{
  "schemaVersion": 1,
  "snapshotId": "attackers-series-2026-09-04-partial-003",
  "providerKey": "attackers",
  "provider": "attackers.series",
  "sourceId": "source_attackers_official",
  "makerId": "maker_000004",
  "indexUrl": "https://attackers.net/works/series",
  "capturedAt": "2026-09-04",
  "captureMethod": "web-review",
  "completeTraversal": false,
  "notes": [
    "0.4.7 Batch C：继续沿官方 Series Index 顺序扩展下一段可核验条目；本文件仍是 partial snapshot，不得用于完整性声明。",
    "条目逐项通过官方 Series 详情页核对。已发布 ID 保留用于 Diff 精确命中；历史 hold（attackers.series:2273）不因新 Snapshot 消失而自动改变审核状态。"
  ],
  "entries": [
    {
      "position": 1,
      "externalId": "2287",
      "nameJa": "不埒な姦係",
      "sourceUrl": "https://attackers.net/works/list/series/2287"
    },
    {
      "position": 2,
      "externalId": "2288",
      "nameJa": "あなたが欲しくて",
      "sourceUrl": "https://attackers.net/works/list/series/2288"
    },
    {
      "position": 3,
      "externalId": "2290",
      "nameJa": "背徳の契り",
      "sourceUrl": "https://attackers.net/works/list/series/2290"
    },
    {
      "position": 4,
      "externalId": "2291",
      "nameJa": "鬱勃起",
      "sourceUrl": "https://attackers.net/works/list/series/2291"
    },
    {
      "position": 5,
      "externalId": "2292",
      "nameJa": "抱かれるための出社",
      "sourceUrl": "https://attackers.net/works/list/series/2292"
    },
    {
      "position": 6,
      "externalId": "2293",
      "nameJa": "脱獄者",
      "sourceUrl": "https://attackers.net/works/list/series/2293"
    },
    {
      "position": 7,
      "externalId": "2295",
      "nameJa": "舐め犯し",
      "sourceUrl": "https://attackers.net/works/list/series/2295"
    },
    {
      "position": 8,
      "externalId": "2298",
      "nameJa": "素人強姦面接",
      "sourceUrl": "https://attackers.net/works/list/series/2298"
    },
    {
      "position": 9,
      "externalId": "2299",
      "nameJa": "死夜悪アンソロジー",
      "sourceUrl": "https://attackers.net/works/list/series/2299"
    },
    {
      "position": 10,
      "externalId": "2300",
      "nameJa": "蛇縛の拷問折檻",
      "sourceUrl": "https://attackers.net/works/list/series/2300"
    },
    {
      "position": 11,
      "externalId": "2301",
      "nameJa": "BEST",
      "sourceUrl": "https://attackers.net/works/list/series/2301"
    },
    {
      "position": 12,
      "externalId": "2302",
      "nameJa": "凌辱大捜査線",
      "sourceUrl": "https://attackers.net/works/list/series/2302"
    },
    {
      "position": 13,
      "externalId": "2303",
      "nameJa": "これで最後にしてください。",
      "sourceUrl": "https://attackers.net/works/list/series/2303"
    },
    {
      "position": 14,
      "externalId": "2305",
      "nameJa": "女優名鑑",
      "sourceUrl": "https://attackers.net/works/list/series/2305"
    },
    {
      "position": 15,
      "externalId": "2306",
      "nameJa": "遺伝子の悲劇",
      "sourceUrl": "https://attackers.net/works/list/series/2306"
    },
    {
      "position": 16,
      "externalId": "2307",
      "nameJa": "昭和哀歌",
      "sourceUrl": "https://attackers.net/works/list/series/2307"
    },
    {
      "position": 17,
      "externalId": "2308",
      "nameJa": "声を出せない私",
      "sourceUrl": "https://attackers.net/works/list/series/2308"
    },
    {
      "position": 18,
      "externalId": "2309",
      "nameJa": "極道の女",
      "sourceUrl": "https://attackers.net/works/list/series/2309"
    },
    {
      "position": 19,
      "externalId": "2311",
      "nameJa": "くノ一拷問凌辱",
      "sourceUrl": "https://attackers.net/works/list/series/2311"
    },
    {
      "position": 20,
      "externalId": "2312",
      "nameJa": "奴隷色のステージ",
      "sourceUrl": "https://attackers.net/works/list/series/2312"
    }
  ],
  "coverageWindow": {
    "kind": "segment",
    "orderBasis": "manual-review-order",
    "startExternalId": "2287",
    "endExternalId": "2312",
    "resumeAfterExternalId": "2312",
    "continuesFromSnapshotId": "attackers-series-2026-09-04-partial-002",
    "notes": [
      "resume anchor 只表示下一次人工审核从该详情锚点之后继续，不声明外部 ID 连续，也不证明中间不存在未发现 Series。"
    ]
  }
}
